Name,Subtitle,Group,Icon,Description,Address,Latitude,Longitude,GoogleMapsLink,Image1,Image1Caption,Image1Source,Image1SourceLink,Image2,Image2Caption,Image2Source,Image2SourceLink,Image3,Image3Caption,Image3Source,Image3SourceLink,Image4,Image4Caption,Image4Source,Image4SourceLink,Image5,Image5Caption,Image5Source,Image5SourceLink
On Mission and Kansas River,"June 29, 1853",,media/marker.png,"<img src=""media/006.png"" alt=""Drawing of Mission & Kansas Rivers""> <br /><img src=""media/007.png"" alt=""Photograph of Mission & Kansas Rivers"">",,39.06425929,-95.83484556,,,,,,,,,,,,,,,,,,,,,
Fort Centre or Riley- Junction of Smokey Hill and Republican Fork,"July 3, 1853",,media/marker.png,"<img src=""media/011.png"" alt=""Drawing of Fort Riley at the junction of the Smokey Hill and Republican rivers""> <br /><img src=""media/012.png"" alt=""Photograph of Fort Riley at the junction of the Smokey Hill and Republican rivers"">",,39.06058635,-96.80202841,,,,,,,,,,,,,,,,,,,,,
Bents Fort,"July 29, 1853",,media/marker.png,"<img src=""media/018.png"" alt=""Drawing of Bent’s Fort""> <br /><img src=""media/019.png"" alt=""Photograph of Bent’s Fort"">",,38.04452676,-103.4332941,,,,,,,,,,,,,,,,,,,,,
The Plains,"August 1(?), 1853",,media/marker.png,"<img src=""media/022.png"" alt=""Continuous panoramic drawing of the plains""> <br /><img src=""media/023.png"" alt=""Photograph of plains south of Olney Springs, CO."">",,38.13313507,-103.974054,,,,,,,,,,,,,,,,,,,,,
Bluff on the Arkansas River,"August 1, 1853",,media/marker.png,"<img src=""media/025.png"" alt=""Drawing of Bluff on Arkansas""> <br /><img src=""media/026.png"" alt=""Photograph near Bluff on Arkansas"">",,38.14192399,-104.0003698,,,,,,,,,,,,,,,,,,,,,
Mouth of the Apishpa River - Ferry on the Arkansas,August 1 1853,,media/marker.png,"<img src=""media/028.png"" alt=""Drawing of (Mouth of the Apishapa River) Ferry, Arkansas""> <br /><img src=""media/029.png"" alt=""Photograph near site of the Arkansas River ferry at the mouth of the Apishapa River, Arkansas"">",,38.12783685,-103.9743443,,,,,,,,,,,,,,,,,,,,,
Pikes Peak,"August 6, 1853",,media/marker.png,"<p><h3>Images from Mount Mestas to Pikes Peak</h3><img src=""media/032.png"" alt=""Drawings arranged as a continuous panorama from Mount Mestas to Pikes Peak""> <br /><img src=""media/033.png"" alt=""Photograph panorama from Mount Mestas to Pikes Peak""></p><p><h3>Images from Pikes Peak</h3><img src=""media/035.png"" alt=""Drawings of Pikes Peak""> <br /><img src=""media/036.png"" alt=""Photograph of Pikes Peak"">",,37.665725,-104.681824,,,,,,,,,,,,,,,,,,,,,
Spanish Peaks from near the Cuchara River,"August 6, 1853",,media/marker.png,,,37.665725,-104.681824,,,,,,,,,,,,,,,,,,,,,
View of Southern Rocky Mountains,August 6 1853,,media/marker.png,,,37.665725,-104.681824,,,,,,,,,,,,,,,,,,,,,
First Chain of Rocky Mountains Eastern Base,August 6 1853,,media/marker.png,,,37.665725,-104.681824,,,,,,,,,,,,,,,,,,,,,
Second Huerfano Butte from the Upper Huerfano River,"August 8-9, 1853",,media/marker.png,,,37.761873,-104.8255414,,,,,,,,,,,,,,,,,,,,,
Sierra Mojada from Camp 40 ,"August 10, 1853",,media/marker.png,,,37.699834,-105.13605,,,,,,,,,,,,,,,,,,,,,
Wet Mountains,"August 10, 1853",,media/marker.png,,,37.699834,-105.13605,,,,,,,,,,,,,,,,,,,,,
Main Chain of Sierra Blanca Eastern Slopes ,"August 10, 1853",,media/marker.png,,,37.699834,-105.13605,,,,,,,,,,,,,,,,,,,,,
"View eastward from El Sangre de Cristo Pass, including Huerfano River ","August 10-11, 1853",,media/marker.png,,,37.699834,-105.13605,,,,,,,,,,,,,,,,,,,,,
Huerfano River near Camp 40 ,"August 10-11, 1853",,media/marker.png,,,37.699834,-105.13605,,,,,,,,,,,,,,,,,,,,,
Wet Mountains and the Huerfano River,"August 11, 1853",,media/marker.png,,,37.641702,-104.7464209,,,,,,,,,,,,,,,,,,,,,
Les Trois Tetons in the distance ,August 11 1853,,media/marker.png,,,37.641702,-105.172393,,,,,,,,,,,,,,,,,,,,,
From a ridge above Sangre de Cristo Pass ,"August 15, 1853",,media/marker.png,,,37.620891,-105.192009,,,,,,,,,,,,,,,,,,,,,
St. Luis Valley and Williams Ranch ,"August 19, 1853",,media/marker.png,,,37.500083,-105.398743,,,,,,,,,,,,,,,,,,,,,
Main Peaks of Sierra Blanca and Fort Massachusetts ,"August 19-23, 1853",,media/marker.png,,,37.496499,-105.397032,,,,,,,,,,,,,,,,,,,,,
Panorama from near old Fort Valdez ,"August 20, 1853",,media/marker.png,,,37.486285,-105.40135,,,,,,,,,,,,,,,,,,,,,
Sierra Blanca ,"August 23, 1853",,media/marker.png,,,37.526893,-105.541186,,,,,,,,,,,,,,,,,,,,,
San Juan Mountains panorama ,"August 23, 1853",,media/marker.png,,,37.526456,-105.541918,,,,,,,,,,,,,,,,,,,,,
Peaks of the Sierra Blanca,"August 19-23, 1853",,media/marker.png,,,37.564731,-105.675107,,,,,,,,,,,,,,,,,,,,,
Panoramic view of the Sierra Blanca,"August 27, 1853",,media/marker.png,,,37.813583,-105.633355,,,,,,,,,,,,,,,,,,,,,
Northwest through Gunnison’s Pass,"August 28, 1853",,media/marker.png,,,,,,,,,,,,,,,,,,,,,,,,,
Panorama of the Rocky Mountains ,"August 28, 1853",,media/marker.png,,,38.058523,-105.820611,,,,,,,,,,,,,,,,,,,,,
Entrance to Coochutoke Pass,"August 30, 1853",,media/marker.png,,,38.093368,-106.060939,,,,,,,,,,,,,,,,,,,,,
Entrance to Del Norte ,"August 30, 1853",,media/marker.png,,,38.089784,-106.05125,,,,,,,,,,,,,,,,,,,,,
Saguache Mountains and San Luis Valley ,"August 30, 1853",,media/marker.png,,,38.060549,-105.797291,,,,,,,,,,,,,,,,,,,,,
Sah-watch Creek in Coo-che-to-pa Pass ,"August 31, 1853",,media/marker.png,,,38.15193598,-106.2720611,,,,,,,,,,,,,,,,,,,,,
Near the summit of Coo-che-to-Pa Pass,"August 31, 1853",,media/marker.png,,,38.163847,-106.314854,,,,,,,,,,,,,,,,,,,,,
"Coo-che-to-pa Pass, leaving Saw-watch Creek","September 1, 1853",,media/marker.png,,,38.162495,-106.4656118,,,,,,,,,,,,,,,,,,,,,
"In Coo-che-to-pa Pass, leaving Saw-watch Creek","September 1, 1853",,media/marker.png,,,38.185588,-106.5109268,,,,,,,,,,,,,,,,,,,,,
In Sangre de Cristo Pass ,"September 2, 1853",,media/marker.png,,,38.218993,-106.581219,,,,,,,,,,,,,,,,,,,,,
West of Coo-che-to-Pa Pass ,September 1 1853,,media/marker.png,,,38.180722,-106.581817,,,,,,,,,,,,,,,,,,,,,
West of Coo-che-to-Pa Pass on Pass Creek ,"September 3, 1853",,media/marker.png,,,38.23652387,-106.6473912,,,,,,,,,,,,,,,,,,,,,
Pass Creek ,"September 3, 1853",,media/marker.png,,,38.288489,-106.746783,,,,,,,,,,,,,,,,,,,,,
West of the Summit in Coochetopa Pass ,"September 3, 1853",,media/marker.png,,,38.310061,-106.764712,,,,,,,,,,,,,,,,,,,,,
Divide between Gulf of Mexico and Pacific Ocean,"September 3, 1853",,media/marker.png,,,38.352325,-106.715575,,,,,,,,,,,,,,,,,,,,,
Co-che-to-pa Creek ,"September 3, 1853",,media/marker.png,,,38.367121,-106.694488,,,,,,,,,,,,,,,,,,,,,
Divide Between the Gulf of Mexico ,"September 3, 1853",,media/marker.png,,,38.377271,-106.673556,,,,,,,,,,,,,,,,,,,,,
Camp Rock (Eagle Tail) ,"September 3, 1853",,media/marker.png,,,38.377763,-106.674348,,,,,,,,,,,,,,,,,,,,,
Sahwatch Mountains ,"September 5, 1853",,media/marker.png,,,38.416574,-106.642091,,,,,,,,,,,,,,,,,,,,,
Sahwatch Mountains ,"September 5, 1853",,media/marker.png,,,38.41827876,-106.6438751,,,,,,,,,,,,,,,,,,,,,
West end of Coo-che-to-pa Pass ,"September 5, 1853",,media/marker.png,,,38.418546,-106.643464,,,,,,,,,,,,,,,,,,,,,
Coochetopa Creek near its junction with Grand River ,"September 5, 1853",,media/marker.png,,,38.441877,-106.626717,,,,,,,,,,,,,,,,,,,,,
West end of Coochetopa Pass ,"September 5, 1853",,media/marker.png,,,38.544594,-106.897439,,,,,,,,,,,,,,,,,,,,,
View up Grand River first mesa ,"September 6, 1853",,media/marker.png,,,38.516609,-106.962,,,,,,,,,,,,,,,,,,,,,
On Grand River ,"September 6, 1853",,media/marker.png,,,38.51921,-106.97052,,,,,,,,,,,,,,,,,,,,,
From Camp on Grand River ,"September 7, 1853",,media/marker.png,,,38.494524,-107.031987,,,,,,,,,,,,,,,,,,,,,
On Grand River from Camp ,"September 7, 1853",,media/marker.png,,,38.494331,-107.032067,,,,,,,,,,,,,,,,,,,,,
Valley of Grand River ,"September 7, 1853",,media/marker.png,,,38.489182,-107.040817,,,,,,,,,,,,,,,,,,,,,
On Twin Creek - Grand River Country ,"September 7, 1853",,media/marker.png,,,38.489144,-107.06149,,,,,,,,,,,,,,,,,,,,,
Grand River ,"September 7, 1853",,media/marker.png,,,38.486796,-107.0658,,,,,,,,,,,,,,,,,,,,,
On Grand River,"September 7, 1853",,media/marker.png,,,,,,,,,,,,,,,,,,,,,,,,,
Side Valley of Grand River ,"September 8, 1853",,media/marker.png,,,38.481829,-107.114144,,,,,,,,,,,,,,,,,,,,,
Northern Slope on Grand River,"September 8, 1853",,media/marker.png,,,,,,,,,,,,,,,,,,,,,,,,,
Affluent of Grand River ,"September 8, 1853",,media/marker.png,,,38.465115,-107.20366,,,,,,,,,,,,,,,,,,,,,
Grand River Cañon ,"September 8, 1853",,media/marker.png,,,38.463638,-107.210431,,,,,,,,,,,,,,,,,,,,,
Lake Fork ,"September 10, 1853",,media/marker.png,,,38.459001,-107.300391,,,,,,,,,,,,,,,,,,,,,
Formation of the Canon of the Grand River ,"September 10, 1853",,media/marker.png,,,38.45317,-107.33754,,,,,,,,,,,,,,,,,,,,,
Grand River Cañon ,"September 10, 1853",,media/marker.png,,,38.449986,-107.347537,,,,,,,,,,,,,,,,,,,,,
Salt Creek Canyon towards Grand River ,"September 10, 1853",,media/marker.png,,,38.448724,-107.31062,,,,,,,,,,,,,,,,,,,,,
Grand River Cañons ,"September 11, 1853",,media/marker.png,,,38.423767,-107.401016,,,,,,,,,,,,,,,,,,,,,
Un-com-pah-gre Mountains ,"September 11, 1853",,media/marker.png,,,38.441235,-107.37994,,,,,,,,,,,,,,,,,,,,,
From Camp 62 ,"September 11, 1853",,media/marker.png,,,38.411026,-107.525792,,,,,,,,,,,,,,,,,,,,,
Valley of the Cebolla Creek ,"September 11, 1853",,media/marker.png,,,38.404677,-107.40776,,,,,,,,,,,,,,,,,,,,,
Un-com-pah-gre Mountains ,"September 14, 1853",,media/marker.png,,,38.491959,-107.729463,,,,,,,,,,,,,,,,,,,,,
Elk Mountains ,"September 16, 1853",,media/marker.png,,,38.737205,-108.010429,,,,,,,,,,,,,,,,,,,,,
Un-com-pah-gre Mountains ,"September 18, 1853",,media/marker.png,,,38.904704,-108.362982,,,,,,,,,,,,,,,,,,,,,
Salt Creek Canyon ,"September 21, 1853",,media/marker.png,,,39.2352,-108.899659,,,,,,,,,,,,,,,,,,,,,
Desert between Grand River and Green River ,"September 22, 1853",,media/marker.png,,,39.078727,-109.222153,,,,,,,,,,,,,,,,,,,,,
Desert between Grand River and Green River ,"September 28, 1853",,media/marker.png,,,38.950414,-109.400137,,,,,,,,,,,,,,,,,,,,,
Book Mountains ,"September 29, 1853",,media/marker.png,,,38.947245,-109.82345,,,,,,,,,,,,,,,,,,,,,
Desert between Grand River and Green River ,"September 28, 1853",,media/marker.png,,,38.904263,-109.862206,,,,,,,,,,,,,,,,,,,,,
Book Mountains ,"September 29, 1853",,media/marker.png,,,39.011008,-110.130871,,,,,,,,,,,,,,,,,,,,,
Green River Country ,"September 30, 1853",,media/marker.png,,,39.014196,-110.131997,,,,,,,,,,,,,,,,,,,,,
Rock Hills ,"October 1, 1853",,media/marker.png,,,39.025359,-110.163136,,,,,,,,,,,,,,,,,,,,,
Green River ,"October 1, 1853",,media/marker.png,,,38.993923,-110.143128,,,,,,,,,,,,,,,,,,,,,
From Camp 81 on White River ,"October 4, 1853",,media/marker.png,,,39.333271,-110.40172,,,,,,,,,,,,,,,,,,,,,
Clever Creek ,"October 5, 1853",,media/marker.png,,,39.419651,-110.48948,,,,,,,,,,,,,,,,,,,,,
On the Garambulla Creek ,"October 10, 1853",,media/marker.png,,,39.08754,-111.038061,,,,,,,,,,,,,,,,,,,,,
Near Wah-satch Pass ,"October 12, 1853",,media/marker.png,,,38.767644,-111.38176,,,,,,,,,,,,,,,,,,,,,
Little Mountains ,"October 12, 1853",,media/marker.png,,,38.768492,-111.385157,,,,,,,,,,,,,,,,,,,,,
Bluff and Pictograph ,"October 13, 1853",,media/marker.png,,,38.830871,-111.539927,,,,,,,,,,,,,,,,,,,,,
Sierra de Wahsatch on White Pine Creek ,"October 14, 1853",,media/marker.png,,,38.793852,-111.585984,,,,,,,,,,,,,,,,,,,,,
Entering Sevier River Valley ,"October 17, 1853",,media/marker.png,,,38.93024437,-111.811482,,,,,,,,,,,,,,,,,,,,,
Kah-kah-nak-ah-rah-nit ,"October 19, 1853",,media/marker.png,,,39.362774,-111.958578,,,,,,,,,,,,,,,,,,,,,
From Mormon Bridge on the Sevier River ,"October 20, 1853",,media/marker.png,,,39.368442,-111.97158,,,,,,,,,,,,,,,,,,,,,
Great Basin ,"October 25, 1853",,media/marker.png,,,39.097643,-112.271088,,,,,,,,,,,,,,,,,,,,,